{"dataset":"synthetic","diagnostic_counts":{"error_count":0,"total_count":0,"warning_count":0},"diagnostics":[],"evaluation_contract":{"schema_sha256":"05dcb1c0fb92f4ca577b755985056e0551aaadb99355bfefb783181378a3e85b","sha256":"68513164a731d977988acc34f7013cc3000c78d5e6aa345b2f7bcbe3e346de3e","version":"0.1.0"},"evaluation_run_id":"evaluation-synthetic-evaluation_oracle-e1ee06d3a671ee1b","evaluator":{"name":"technical_evaluation","version":"0.1.0"},"event_accounting":{"eligible_event_count":4,"excluded_event_count":0,"missed_eligible_event_count":0,"outcomes":[{"cue_ids":["cue-oracle-1","cue-oracle-2"],"event_id":"evt:synthetic:evaluation_oracle:f000000:t1:r000001","exclusion_code":null,"outcome":"represented","suppression_code":null},{"cue_ids":["cue-oracle-3"],"event_id":"evt:synthetic:evaluation_oracle:f000010:t2:r000002","exclusion_code":null,"outcome":"represented","suppression_code":null},{"cue_ids":[],"event_id":"evt:synthetic:evaluation_oracle:f000015:t3:r000003","exclusion_code":null,"outcome":"suppressed","suppression_code":"oracle_excluded"},{"cue_ids":["cue-oracle-4"],"event_id":"evt:synthetic:evaluation_oracle:f000020:t4:r000004","exclusion_code":null,"outcome":"represented","suppression_code":null},{"cue_ids":["cue-oracle-5"],"event_id":"evt:synthetic:evaluation_oracle:f000022:t5:r000005","exclusion_code":null,"outcome":"represented","suppression_code":null}],"represented_event_count":4,"suppressed_event_count":1,"valid_event_count":5},"input_hashes":{"audio_package_sha256":"9999999999999999999999999999999999999999999999999999999999999999","cue_package_sha256":"8888888888888888888888888888888888888888888888888888888888888888","cue_schedule_sha256":"3333333333333333333333333333333333333333333333333333333333333333","event_package_sha256":"1111111111111111111111111111111111111111111111111111111111111111","preset_sha256":"2222222222222222222222222222222222222222222222222222222222222222","render_log_sha256":"5555555555555555555555555555555555555555555555555555555555555555","renderer_configuration_sha256":"7777777777777777777777777777777777777777777777777777777777777777","suppression_log_sha256":"4444444444444444444444444444444444444444444444444444444444444444","wav_sha256":"6666666666666666666666666666666666666666666666666666666666666666"},"input_versions":{"cue_package":"0.1.0","event_schema":"0.2.0","mapper":"0.1.0","preset":"0.1.0","renderer_configuration":"0.1.0","renderer_metadata":"0.1.0"},"metrics":{"cue_density":{"cue_count":5,"cues_per_minute":100.0,"cues_per_second":1.6666666666666667,"maximum_cues_starting_in_half_open_one_second_window":2,"unique_represented_event_count":4,"unique_represented_events_per_second":1.3333333333333333},"event_coverage":{"accounting_completeness":{"denominator":5,"numerator":5,"value":1.0},"eligible_event_coverage":{"denominator":4,"numerator":4,"value":1.0},"missed_eligible_event_rate":{"denominator":4,"numerator":0,"value":0.0},"source_representation_rate":{"denominator":5,"numerator":4,"value":0.8},"suppression_rate":{"denominator":5,"numerator":1,"value":0.2}},"overlap_burden":{"excess_concurrent_cue_seconds":1.2,"interval_basis":"rendered_samples","normalised_overlap_burden":{"denominator":3.0,"numerator":1.2,"value":0.4},"overlap_duration_seconds":1.2,"overlap_proportion":{"denominator":3.0,"numerator":1.2,"value":0.4},"peak_concurrency":2},"reproducibility":{"audio":{"equal":true,"files":[{"byte_identical":true,"expected_sha256":"6666666666666666666666666666666666666666666666666666666666666666","filename":"sonification.wav","hash_identical":true,"mismatch":null,"observed_sha256":"6666666666666666666666666666666666666666666666666666666666666666"}],"tested":true},"byte":{"equal":true,"files":[{"byte_identical":true,"expected_sha256":"1111111111111111111111111111111111111111111111111111111111111111","filename":"events.json","hash_identical":true,"mismatch":null,"observed_sha256":"1111111111111111111111111111111111111111111111111111111111111111"}],"tested":true},"claim_scope":"tested_environment_only","configuration":{"comparisons":[{"expected_sha256":"2222222222222222222222222222222222222222222222222222222222222222","expected_version":"0.1.0","identical":true,"name":"preset","observed_sha256":"2222222222222222222222222222222222222222222222222222222222222222","observed_version":"0.1.0"},{"expected_sha256":"7777777777777777777777777777777777777777777777777777777777777777","expected_version":"0.1.0","identical":true,"name":"renderer","observed_sha256":"7777777777777777777777777777777777777777777777777777777777777777","observed_version":"0.1.0"}],"equal":true,"tested":true},"environment_scope":"same synthetic test process","semantic":{"equal":true,"metrics_equal":true,"records_equal":true,"tested":true}},"timing_alignment":{"end_to_end":{"samples":{"count":5,"maximum":5.0,"mean":1.0,"median":0.0,"minimum":0.0,"p95":5.0},"seconds":{"count":5,"maximum":0.5,"mean":0.11,"median":0.0,"minimum":0.0,"p95":0.5}},"render_placement":{"samples":{"count":5,"maximum":0.0,"mean":0.0,"median":0.0,"minimum":0.0,"p95":0.0},"seconds":{"count":5,"maximum":0.05,"mean":0.01,"median":0.0,"minimum":0.0,"p95":0.05}},"sample_rounding":"decimal_round_half_up","scheduling":{"samples":{"count":5,"maximum":5.0,"mean":1.0,"median":0.0,"minimum":0.0,"p95":5.0},"seconds":{"count":5,"maximum":0.5,"mean":0.1,"median":0.0,"minimum":0.0,"p95":0.5}}},"traceability":{"broken_links":[],"cue_to_event":{"denominator":5,"numerator":5,"value":1.0},"cue_to_rendered_sample":{"denominator":5,"numerator":5,"value":1.0},"cue_to_source_annotation":{"denominator":5,"numerator":5,"value":1.0},"fully_traceable_cue":{"denominator":5,"numerator":5,"value":1.0},"traceable_suppression_record":{"denominator":1,"numerator":1,"value":1.0}}},"output_hash":{"algorithm":"sha256","scope":"canonical_report_without_output_hash","sha256":"f96d51fd13d3f36c0c515606f6271c47aee9524d0237e9518d6d13d17e3d9c30"},"report_version":"0.1.0","sequence":"evaluation_oracle","timeline":{"basis":"rendered_total_frame_count","duration_seconds":3.0,"end_sample_exclusive":30,"end_seconds":3.0,"sample_rate_hz":10,"start_sample":0,"start_seconds":0.0},"valid":true}
